{
  "schema_version": "answer_evidence.v1",
  "canonical_id": "cq_topic_0c5b15b3",
  "candidate_sha256": "bae08109cbc0cbc26be3db3aff5dfcf0e52fa090ff8aa16cc7e1d319ce82ab89",
  "checked_at": "2026-07-11",
  "writer": {"writer_id": "answer-curator", "writer_version": "search-design-inverted-index.v1"},
  "sources": [
    {"source_id": "lucene-10-index-package", "title": "Apache Lucene 10.3.0 org.apache.lucene.index package summary", "locator": "https://lucene.apache.org/core/10_3_0/core/org/apache/lucene/index/package-summary.html", "source_type": "official_documentation", "checked_at": "2026-07-11"},
    {"source_id": "elastic-current-index-search-analysis", "title": "Elasticsearch current: Index and search analysis", "locator": "https://www.elastic.co/guide/en/elasticsearch/reference/current/analysis-index-search-time.html", "source_type": "official_documentation", "checked_at": "2026-07-11"},
    {"source_id": "elastic-current-text-field", "title": "Elasticsearch current: Text field type", "locator": "https://www.elastic.co/guide/en/elasticsearch/reference/current/text.html", "source_type": "official_documentation", "checked_at": "2026-07-11"},
    {"source_id": "elastic-current-search-analyzer", "title": "Elasticsearch current: search_analyzer mapping parameter", "locator": "https://www.elastic.co/docs/reference/elasticsearch/mapping-reference/search-analyzer", "source_type": "official_documentation", "checked_at": "2026-07-11"},
    {"source_id": "elastic-current-aliases", "title": "Elasticsearch current: Aliases", "locator": "https://www.elastic.co/guide/en/elasticsearch/reference/current/aliases.html", "source_type": "official_documentation", "checked_at": "2026-07-11"},
    {"source_id": "elastic-current-occ", "title": "Elasticsearch current: Optimistic concurrency control", "locator": "https://www.elastic.co/docs/reference/elasticsearch/rest-apis/optimistic-concurrency-control", "source_type": "official_documentation", "checked_at": "2026-07-11"},
    {"source_id": "elastic-current-snapshot-restore", "title": "Elasticsearch current: Snapshot and restore", "locator": "https://www.elastic.co/guide/en/elasticsearch/reference/current/snapshot-restore.html", "source_type": "official_documentation", "checked_at": "2026-07-11"}
  ],
  "claims": [
    {"claim_id": "lucene-postings-term-lookup-boundary", "text": "Lucene 10.3 documents its inverted index as postings plus a term dictionary: a term maps to an ordered list of documents containing it, while postings do not efficiently retrieve terms given a document without scanning the index.", "source_ids": ["lucene-10-index-package"], "answer_locations": ["核心结论", "1 分钟版", "3 分钟版", "关键细节", "原理机制", "常见追问", "易错点"]},
    {"claim_id": "elastic-analysis-consistency", "text": "Elasticsearch current documentation states that text analysis happens at indexing and full-text search time, and that using the same analyzer normally makes indexed values and query strings produce matching token forms; a separate search analyzer is for explicit cases such as prefix search or search-time synonyms.", "source_ids": ["elastic-current-index-search-analysis", "elastic-current-search-analyzer"], "answer_locations": ["核心结论", "3 分钟版", "关键细节", "原理机制", "常见追问", "易错点"]},
    {"claim_id": "elastic-text-field-boundary", "text": "Elasticsearch documents that text fields are analyzed into terms for full-text search and are not used for sorting; multi-fields allow the same string to be indexed differently for search versus sorting or aggregations.", "source_ids": ["elastic-current-text-field"], "answer_locations": ["3 分钟版", "关键细节", "易错点"]},
    {"claim_id": "elastic-alias-routing-filter-boundary", "text": "Elasticsearch aliases support atomic multi-action add/remove operations, alias routing options, and Query DSL filters; the documentation also states that alias filters do not apply to document retrieval by ID.", "source_ids": ["elastic-current-aliases"], "answer_locations": ["1 分钟版", "3 分钟版", "关键细节", "原理机制", "常见追问", "易错点"]},
    {"claim_id": "elastic-occ-version-boundary", "text": "Elasticsearch documents optimistic concurrency control using `_seq_no` and `_primary_term`, with conditional writes via `if_seq_no` and `if_primary_term` to prevent an older change from overwriting a newer change.", "source_ids": ["elastic-current-occ"], "answer_locations": ["1 分钟版", "3 分钟版", "关键细节", "常见追问"]},
    {"claim_id": "elastic-snapshot-recovery-boundary", "text": "Elasticsearch documents snapshots as off-cluster backups that can restore data and cluster state/configuration; compatibility, registered repository, and recovery capacity remain restore prerequisites.", "source_ids": ["elastic-current-snapshot-restore"], "answer_locations": ["3 分钟版", "关键细节", "常见追问", "易错点"]},
    {"claim_id": "search-system-design-assumptions", "text": "The 100M documents, 2KB average source, 20k QPS, 60-second visibility, 150ms P99, source-version protocol, authority choice, ACL invariant, checkpoint replay, load-test formulas, rollout thresholds and recovery objectives are explicit scenario assumptions and acceptance criteria. They are not claimed Elasticsearch defaults or production facts.", "source_ids": ["lucene-10-index-package", "elastic-current-index-search-analysis", "elastic-current-aliases", "elastic-current-occ", "elastic-current-snapshot-restore"], "answer_locations": ["核心结论", "1 分钟版", "3 分钟版", "关键细节", "原理机制", "项目经验版", "常见追问", "易错点"]}
  ],
  "source_question_coverage": [
    {"question_id": "b2db9f83ebd0470b99449be5ba5f663f", "covered": true, "answer_locations": ["核心结论", "1 分钟版", "3 分钟版", "原理机制", "常见追问"]},
    {"question_id": "d56126c8f3f4be9c64dc7ba496cf18e6", "covered": true, "answer_locations": ["核心结论", "1 分钟版", "3 分钟版", "原理机制", "常见追问"]}
  ],
  "review": {
    "reviewer_id": "isolated-reviewer",
    "review_version": "r2",
    "independent": true,
    "decision": "revise",
    "revision_round": 2,
    "scores": {"facts_and_evidence": 24, "directness_and_relevance": 18, "type_specific_completeness": 18, "mechanism_and_causality": 14, "boundaries_and_tradeoffs": 9, "followup_quality": 5, "oral_quality": 3},
    "hard_failures": [],
    "uncovered_source_variants": [],
    "unsupported_claims": [],
    "findings": [
      "候选覆盖来源问法，场景题所需的假设、容量、数据流、一致性、恢复、观测、压测、灰度和替代方案均完整。",
      "1 分钟版的四个主点信息密度超过实际一分钟口述范围，且 3 分钟版存在较多重复；口述分 3，低于最低分 4。",
      "按两轮上限停止修订。"
    ]
  }
}
