{
  "schema_version": "answer_evidence.v1",
  "canonical_id": "cq_daemon_thread_a38b0a9b",
  "candidate_sha256": "8066962d690463733589a9c9adf9a55d29e3b1206fe350a84b71e0680818c002",
  "checked_at": "2026-07-11",
  "writer": {"writer_id":"answer-curator","writer_version":"daemon-thread-jdk21.v1"},
  "sources": [{"source_id":"java-se21-thread","title":"Java SE 21 Thread API","locator":"https://docs.oracle.com/en/java/javase/21/docs/api/java.base/java/lang/Thread.html","source_type":"official_documentation","checked_at":"2026-07-11"}],
  "claims": [
    {"claim_id":"shutdown-and-setdaemon","text":"Java SE 21 specifies that shutdown begins when all started non-daemon platform threads terminate; setDaemon must be invoked before start and throws IllegalThreadStateException if the platform thread is alive.","source_ids":["java-se21-thread"],"answer_locations":["核心结论","1 分钟版","3 分钟版","关键细节","常见追问","易错点"]},
    {"claim_id":"inheritance-and-virtual-thread-boundary","text":"Java SE 21 specifies that a newly created platform thread inherits daemon status from its creator, while virtual threads are always daemon and cannot be changed to non-daemon with setDaemon.","source_ids":["java-se21-thread"],"answer_locations":["3 分钟版","关键细节","常见追问","易错点"]}
  ],
  "source_question_coverage": [{"question_id":"4abd83ed191b4e153ffe18ddca9ca27d","covered":true,"answer_locations":["核心结论","1 分钟版","3 分钟版","关键细节","原理机制","常见追问","易错点"]}],
  "review": {"reviewer_id":"isolated-reviewer-daemon-thread-r2","review_version":"2.0","independent":true,"decision":"pass","revision_round":2,"scores":{"facts_and_evidence":25,"directness_and_relevance":20,"type_specific_completeness":20,"mechanism_and_causality":15,"boundaries_and_tradeoffs":10,"followup_quality":5,"oral_quality":5},"hard_failures":[],"revision_suggestions":[]}
}
